{
  "schema": "rusty.fleet.checkin_signing_vector.v1",
  "test_only": true,
  "claims_fixture": "checkin-claims.valid.json",
  "claims_jcs_sha256": "401ba8b5a3190fc9e34ec8c203d596d69b5a0eb8bd1d7e23996aa5f37146ca04",
  "signature_domain_utf8": "rusty.fleet.signed_checkin.v1\u0000",
  "algorithm": "ed25519-jcs",
  "private_seed_hex": "0707070707070707070707070707070707070707070707070707070707070707",
  "public_key_hex": "ea4a6c63e29c520abef5507b132ec5f9954776aebebe7b92421eea691446d22c",
  "public_key_sha256": "sha256:fe812c12f3ab4ce6ac5db69ac352f906cb1b11ef43fb33e252ef7ff552263889",
  "signing_message_sha256": "a9dd28a3681ccd242fee648a7010b85a69df38147f487e8c4e7e2b08116b8432",
  "signature_hex": "39871cc49151257e753bb7c83dfaf4e507c87f1b1b3381ce1457eef99d43e25752aaa58c695a747eca416cddd16d5bb7e890dd61b24cf8ffb489260bfbcdc602"
}
